,Document/Program/Project Title,Document/Project Date,Action,Document Lead Authors/Project Contact,FP&M Department,Academic/Research/UW Divisions 1,Academic/Research/UW Divisions 2,Academic/Research/UW Divisions 3,Student Organization 1,Student Organization 2,Student Organization 3,Number of Student Participants/yr/class,Total Students Participants,Document Name (if applicable),Document Type,Partnership Type,,School of Human Ecology Site Studies,,,"Dan Okoli (FPM)\, UW-Milwaukee SARUP",FP&M Capital Planning and Development,Landscape Architecture,,,,,,,,CPLA Academic Coordination Report 2014 bryn.xlsx,Spreadsheet,FA,,Recently Completed LEED Projects,Jan-14,Overview of recently contructed LEED certified buildings on the UW-Madison campus.,"Kaufmann\, Dan Okoli (FPM)",FP&M Capital Planning and Development,,,,,,,,,NoLEED-FPM Overview -Kauffman2014-web pt2.pdf,Program Review,F,,Department of Art Building Site Studies,,,"Dan Okoli (FPM)\, UW-Milwaukee SARUPUW-Madison Prof. James SteinerDept of Landscape Architectute",FP&M Capital Planning and Development,Landscape Architecture,,,,,,,,CPLA Academic Coordination Report 2014 bryn.xlsx,Spreadsheet,FA,,Horse Barn Remodel Study - Civil Engineering Capstone 578,Fall 2009 - Spring 2010,Capstone course study of restoration opportunities for the historic Horse Barn on the UW campus. ,"Charles Quagliana\, Dan Okoli (FPM)",FP&M Capital Planning and Development,Engineering ,,,,,,,10,,Personal Communication,FA,,School of Human Ecology Building Study - Civil Engineering Capstone 578,Fall 2010,Capstone course study of addition plans for SOHE Building.,"Charles Quagliana\, Dan Okoli (FPM)",FP&M Capital Planning and Development,Engineering ,,,,,,,10,,Personal Communication,FA,,New Art Building - Civil Engineering Capstone 578,Fall 2009,Capstone course study for new art building.,"Charles Quagliana\, Dan Okoli (FPM)",FP&M Capital Planning and Development,Engineering ,,,,,,,10,,Personal Communication,FA,,Water Science Building Study - Civil Engineering Capstone 578,Spring 2008,Capstone course study for rennovation of Water Science Building.,"Charles Quagliana\, Dan Okoli (FPM)",FP&M Capital Planning and Development,Engineering ,,,,,,,5,,Personal Communication,FA,,Witte Hall Building Study - Civil Engineering Capstone 578,Fall 2012,Capstone course study  for rennovation of Witte Hall.,"Charles Quagliana\, Dan Okoli (FPM)",FP&M Capital Planning and Development,Engineering ,,,,,,,5,,Personal Communication,FA,,Selery Hall Building Study - Civil Engineering Capstone 578,Fall 2013,Capstone course study  for rennovation of Selery Hall.,"Charles Quagliana\, Dan Okoli (FPM)",FP&M Capital Planning and Development,Engineering ,,,,,,,5,,Personal Communication,FA,,Observatory Hill Stromwater Study - Civil Engineering Capstone 578,Spring 2015,Capstone course study for stormwater BMPs on Observatory Hill.,Dan Okoli (FPM),FP&M Capital Planning and Development,Engineering ,,,,,,,10,,Personal Communication,FA,,UW Builds Green Program,,A commitment to the pursuit of LEED Silver for most new and remodeled buildings on campus and the commitment to sustainability in design and construction for other projects.,"Charles Quagliana\, Dan Okoli (FPM)",FP&M Capital Planning and Development,,,,,,,,,,,F,,Lakeshore Nature Preserve Volunteer Program ,1/23/15,"The goal of the Preserve volunteer program is to engage student and community volunteers in a variety of natural areas management and ecological restoration activities in a meaningful way for the volunteer while accomplishing work set out in the work plan. From 2010-2015\, the Preserve has enlisted 3005 volunteers and  15\,501 volunteer hours.","Bryn Scriver (FPM)\, ",FP&M Campus Planning and Landscape Architecture,Lakeshore Nature Preserve,,,,,,,,PreserveVolunteerHours.docx,Program Review,FS,,Controlling Urban Stormwater at the University of Wisconsin-Madison,1/1/08,"Presentation about campus storm water management given in 2008. Numerous recommendations of an engineering firm for more detention basins\, porous concrete/asphalt\, and greenroofs. Many have been implemented by 2015.",Gary Brown (FPM),FP&M Campus Planning and Landscape Architecture,,,,,,,,,Stormwater BMP Summary.pdf,Presentation,F,,Lakeshore Nature Preserve Student Engagement Grants,1/1/15,"The broad purpose of these grants is to facilitate use of the Lakeshore Nature Preserve as a resource for education among UW undergraduates.  Fund are used for purchase of equipment\, supplies\, etc.\, related to specific projects in the Preserve and for student stipends. Funding made possible through the generous support from the Academic Endowment Fund of the Lakeshore Nature Preserve. Funded projects contribute to the collection of data related the Preserve and its use by humans. ",Laura Wyatt (FPM),FP&M Campus Planning and Landscape Architecture,Lakeshore Nature Preserve,,,,,,,,StudentEngagementGrant_2015_final.pdf,Program Review,FAS,,Campus Ecology Research Project,1/1/92,"With funding support from the Center for Biology Education\, the Campus Ecology Research Project coordinated student\, FPM\, and facility manager research collaborations that explored alternative approaches for campus environmental management.  Initiatives included: transportation demand management\, recycling\, water and energy conservation. Project was from 1992 to 1996.",Daniel Einstein,FP&M Campus Planning and Landscape Architecture,,,,,,,,,CPLA Academic Coordination Report.xlsx,Spreadsheet,FA,,Solid Waste Alternatives Project (SWAP),1/1/93,"This SWAP project developed a model for diverting campus surplus equipment and materials (e.g.\, computers\, office furniture\, pallets\, etc.) from landfill disposal. Recycled content office supplies (copy paper\, folders\, notepads\, etc.) were promoted with the preparation of specialized marketing materials and office presentations.  At the conclusion of the pilot\, several students were hired to permanently establish this program within the Division of Business Services.  The program received 1993 Governor’s Waste Reduction and Recycling Award.",Daniel Einstein,FP&M Campus Planning and Landscape Architecture,,,,,,,,,CPLA Academic Coordination Report.xlsx,Spreadsheet,F,,Science Hall Alternatives Practices for Environment (SHAPE),1/1/96,"This Wisconsin Department of Administration funded project provided research and program implementation opportunities for five student staff working on environmentally responsible facility management initiatives in a single academic building--Science Hall.  Activities included: energy and water conservation\, recycling\, and waste/hazardous materials management.  Electricity and water meters were installed in public areas as part of effort to increase awareness of building consumption patterns.   The meters continue to provide data nearly 20 years later.",Daniel Einstein,FP&M Campus Planning and Landscape Architecture,,,,,,,,,CPLA Academic Coordination Report.xlsx,Spreadsheet,F,,Greening the Campus,1/1/00,"Students engaged in a variety of research projects examining campus environmental issues: recycling\, energy\, water conservation\, transportation\, etc.  Students prepared recommendations for FPM consideration. Students prepared an on-line directory of websites created by national programs (government\, private sector\, academic institutions) that addressed environmental management initiatives.  ",Daniel Einstein,FP&M Campus Planning and Landscape Architecture,,,,,,,,,CPLA Academic Coordination Report.xlsx,Spreadsheet,FS,,Cultural Landscape Seminar,3/1/14,"Presentation to seminar on campus cultural landscapes\, especially as relates to Native American sites.","Daniel Einstein\, Aaron Bird Bear (lecturer)",FP&M Campus Planning and Landscape Architecture,,,,,,,,,CPLA Academic Coordination Report.xlsx,Spreadsheet,FA,,LaBASH (landscape architecture student national conference),3/1/14,"Tours of Lakeshore Nature Preserve with CPLA staff focused on ecological restoration\, land management of cultural landscape sites.",Daniel Einstein,FP&M Campus Planning and Landscape Architecture,Lakeshore Nature Preserve,,,,,,,,CPLA Academic Coordination Report.xlsx,Spreadsheet,FS,,1918 Marsh Audio Tour,3/1/13,Worked with group of students/volunteers/faculty on creation of interpretive text detailing natural and cultural history of marsh.,"Daniel Einstein\, John Magnuson\, (emeritus faculty)",FP&M Campus Planning and Landscape Architecture,Zoology,Center for Limnology,,,,,,,CPLA Academic Coordination Report.xlsx,Spreadsheet,FA,,John Muir /Earth Day,4/1/13,Campus walking tour of John Muir sites on campus.,Daniel Einstein,FP&M Campus Planning and Landscape Architecture,,,,,,,,,CPLA Academic Coordination Report.xlsx,Spreadsheet,F,,University of the Air-interview,9/1/13,Radio interview on “John Muir in Wisconsin.”,"Daniel Einstein\, Norman Gilliland(WHA Radio) and Emily Auerbach (English\, faculty)",FP&M Campus Planning and Landscape Architecture,,,,,,,,,CPLA Academic Coordination Report.xlsx,Spreadsheet,F,,University Place,10/1/13,Television interview: “John Muir: The Wisconsin Years”,"Daniel Einstein\, Norman Gilliland (Wisconsin Public Television)",FP&M Campus Planning and Landscape Architecture,,,,,,,,,CPLA Academic Coordination Report.xlsx,Spreadsheet,F,,GreenHouse Learning Community,9/1/13,FP&M and Academic staff led two campus cultural landscape tours/discussions in Lakeshore Nature Preserve.,"Daniel Einstein\, Jack Kloppenburg (faculty)",FP&M Campus Planning and Landscape Architecture,Community and Environmental Sociology,Lakeshore Nature Preserve,,,,,,,CPLA Academic Coordination Report.xlsx,Spreadsheet,FS,,Sustainable Forestry class,11/1/13,Video interview detailing Preserve history.,Daniel Einstein,FP&M Campus Planning and Landscape Architecture,Forest and Wildlife Ecology,Lakeshore Nature Preserve,,,,,,,CPLA Academic Coordination Report.xlsx,Spreadsheet,FA,,Campus Tree Walks,11/1/13,Interview on campus trees.,"Daniel Einstein\, Cathy Middlecamp",FP&M Campus Planning and Landscape Architecture,"Environmental Studies\, Nelson Institute for",,,,,,,,CPLA Academic Coordination Report.xlsx,Spreadsheet,FA,,"Culture\, History\, Environment (CHE) Methods ",3/1/12,"FP&M and Academic staff led tour of Science Hall with emphasis on resource flows through building (water\, energy\, waste\, etc.)","Daniel Einstein\, Bill Cronon (faculty)",FP&M Campus Planning and Landscape Architecture,History,Geography,"Environmental Studies\, Nelson Institute for",,,,,,CPLA Academic Coordination Report.xlsx,Spreadsheet,FA,,GreenHouse Learning Community,9/1/12,FP&M and Academic staff led two campus cultural landscape tours/discussions at Picnic Point.,"Daniel Einstein\, Jack Kloppenburg (faculty)",FP&M Campus Planning and Landscape Architecture,Community and Environmental Sociology,Lakeshore Nature Preserve,,,,,,,CPLA Academic Coordination Report.xlsx,Spreadsheet,FS,,ES 460 Student interviews,11/1/12,FP&M and Academic staff served as interviewees with two students researching history of Science Hall and campus environmental issues.,"Daniel Einstein\, Bill Cronon (faculty)",FP&M Campus Planning and Landscape Architecture,History,Geography,"Environmental Studies\, Nelson Institute for",,,,,,CPLA Academic Coordination Report.xlsx,Spreadsheet,FA,,"""Greening Bascom Mall""",Fall 2012,FP&M staff and class in Urban and Regional Planning developed an inventory of campus green infrastructure; documented existing stormwater conditions on Bascom Hill; identified areas for improvement; focus on student/faculty involvement and public awareness on stormwater BMP’s; promote healthy human/nature partnerships; heighten Madison’s sense of place through the development of green infrastructure projects on campus.,"Gary Brown (FPM)\, Prof. Jim LaGroURPL",FP&M Campus Planning and Landscape Architecture,Urban and Regional Planning,,,,,,10,10,CPLA Academic Coordination Report 2014 bryn.xlsx,Spreadsheet,FA,,“Willow Creek Restoration Project”,Fall 2012,"FP&M staff and class in Urban and Regional Planning developed a report and provided recommendations for improvements to Willow Creek; including how to expand infiltration up in the urban watershed; reduce sediment disposition in Lake Mendota; and redirect the creek to a more natural\, meandering flow pattern.","Gary Brown (FPM)\, Prof. Jim LaGroURPL",FP&M Campus Planning and Landscape Architecture,Urban and Regional Planning,,,,,,9,9,CPLA Academic Coordination Report 2014 bryn.xlsx,Spreadsheet,FA,,UW-Madison Campus Master Plan Update,Future,CPLA staff working with students in the LA planting design courses to develop site inventories on campus and providing recommendations for landscape themes.,"Gary Brown (FPM)\, Prof. John HarringtonDept. of Landscape Architecture",FP&M Campus Planning and Landscape Architecture,Landscape Architecture,,,,,,,,CPLA Academic Coordination Report 2014 bryn.xlsx,Spreadsheet,FA,,UW-Madison Campus Master Plan Update,Future,CPLA staff working with students to review BMP's for stormwater management and the development of innovative green infrastructure projects.,"Gary Brown (FPM)\, Prof. Jim LaGro\, URPL.Prof. John HarringtonDept. of Landscape Architecture.Prof. Ken PotterDept. of Civil/Environmental Engineering.",FP&M Campus Planning and Landscape Architecture,Urban and Regional Planning,Landscape Architecture,Civil and Environmental Engineering,,,,,,CPLA Academic Coordination Report 2014 bryn.xlsx,Spreadsheet,FA,,"Art 224\, 324\, 524: Anagama Kiln/Wood Fire Technology",2001,,"Bryn Scriver (FPM)\, Breckenridge\, Bruce/Art",FP&M Campus Planning and Landscape Architecture,Art ,Lakeshore Nature Preserve,,,,,,,CPLA Academic Coordination Report 2014 bryn.xlsx,Spreadsheet,FA,,Vocalization in chickadees,2001,,"Bryn Scriver (FPM)\, Clemmons\, Jackie/Zoology",FP&M Campus Planning and Landscape Architecture,,Lakeshore Nature Preserve,,,,,,,CPLA Academic Coordination Report 2014 bryn.xlsx,Spreadsheet,FA,,Anthro 352: Ancient Technology and Invention/Manufacture of Ancient Tools and Pottery ,2001,,"Bryn Scriver (FPM)\, Kenoyer\, Jonathan/Anthropology",FP&M Campus Planning and Landscape Architecture,Anthropology,Lakeshore Nature Preserve,,,,,25,25,CPLA Academic Coordination Report 2014 bryn.xlsx,Spreadsheet,FA,,Burial/excavation of carcasses ,2001,,"Bryn Scriver (FPM)\, Kirsch\, John; McEntee\, Holly/Zoo Museum",FP&M Campus Planning and Landscape Architecture,Zoology,Lakeshore Nature Preserve,,,,,,,CPLA Academic Coordination Report 2014 bryn.xlsx,Spreadsheet,FA,,Bird Population Changes with prairie restoration,2001,,"Bryn Scriver (FPM)\, McDonald\, Mara",FP&M Campus Planning and Landscape Architecture,,Lakeshore Nature Preserve,,,,,,,CPLA Academic Coordination Report 2014 bryn.xlsx,Spreadsheet,FA,,Botany 130: Campus Field Trips ,2003,,"Bryn Scriver (FPM)\, Clayton\, Mike/Botany",FP&M Campus Planning and Landscape Architecture,Botany,Lakeshore Nature Preserve,,,,,,,CPLA Academic Coordination Report 2014 bryn.xlsx,Spreadsheet,FA,,Bill's Woods Project,2003,,"Bryn Scriver (FPM)\, Denniston\, Glenda; Trewartha\, Mary/Friends of the Preserve ",FP&M Campus Planning and Landscape Architecture,,Lakeshore Nature Preserve,,,,,,,CPLA Academic Coordination Report 2014 bryn.xlsx,Spreadsheet,F,,Capstone Biocore: Mammal Trapping ,2003,,"Bryn Scriver (FPM)\, McDonald\, Mara/Brooks\, Lauren",FP&M Campus Planning and Landscape Architecture,Biocore,Lakeshore Nature Preserve,,,,,,,CPLA Academic Coordination Report 2014 bryn.xlsx,Spreadsheet,FA,,Bot/Zoo 460: Bird Foraging Picnic Point,2003,,"Bryn Scriver (FPM)\, Will-Wolf\, Susan/Botany/Zoology ",FP&M Campus Planning and Landscape Architecture,Botany,Zoology,Lakeshore Nature Preserve,,,,90,?,CPLA Academic Coordination Report 2014 bryn.xlsx,Spreadsheet,FA,,Bot/Zoo 460: Leaf Litter Invertebrates ,2003,,"Bryn Scriver (FPM)\, Will-Wolf\, Susan/Botany/Zoology ",FP&M Campus Planning and Landscape Architecture,Botany,Zoology,Lakeshore Nature Preserve,,,,90,?,CPLA Academic Coordination Report 2014 bryn.xlsx,Spreadsheet,FA,,Bot/Zoo 460: Tree Sampling Muir Woods,2003,,"Bryn Scriver (FPM)\, Will-Wolf\, Susan; Fry\, Tricia/Botany/Zoology",FP&M Campus Planning and Landscape Architecture,Botany,Zoology,Lakeshore Nature Preserve,,,,90,?,CPLA Academic Coordination Report 2014 bryn.xlsx,Spreadsheet,FA,,Entomology 302 and 331: General Insect Collecting,2003,,"Bryn Scriver (FPM)\, Young\, Daniel/Entomology",FP&M Campus Planning and Landscape Architecture,Entomology,Lakeshore Nature Preserve,,,,,120,?,CPLA Academic Coordination Report 2014 bryn.xlsx,Spreadsheet,FA,,IES 375: Field Ecology Workshop/Quarter Point Survey of Wally Bauman Woods,2004,,"Bryn Scriver (FPM)\, Carpenter\, Quentin/Kaiser\, Zachary/Nelson Institute",FP&M Campus Planning and Landscape Architecture,"Environmental Studies\, Nelson Institute for",Lakeshore Nature Preserve,,,,,,,CPLA Academic Coordination Report 2014 bryn.xlsx,Spreadsheet,FA,,"Military Science 644\, 111\, 211\, 311\, 411: Army Leadership Laboratory",2004,,"Bryn Scriver (FPM)\, Warren\, Kevin/Army ROTC",FP&M Campus Planning and Landscape Architecture,Military Science (Army ROTC),Lakeshore Nature Preserve,,,,,60,,CPLA Academic Coordination Report 2014 bryn.xlsx,Spreadsheet,FA,,Soils 325: Field Descriptions of Soil Profiles,2005,,"Bryn Scriver (FPM)\, Styles\, Cynthia/Soil Science",FP&M Campus Planning and Landscape Architecture,Soil Science,Lakeshore Nature Preserve,,,,,25,,CPLA Academic Coordination Report 2014 bryn.xlsx,Spreadsheet,FA,,Biocore 301/302: Biocore Prairie ,2005,,"Bryn Scriver (FPM)\, Batzli\,Janet; McGee\, Seth/Biocore",FP&M Campus Planning and Landscape Architecture,Biocore,Lakeshore Nature Preserve,,,,,150,,CPLA Academic Coordination Report 2014 bryn.xlsx,Spreadsheet,FA,,"Military Science 644\, 111\, 211\, 311\, 411: Army Leadership Laboratory",2005,,"Bryn Scriver (FPM)\, Bechtol\, John; Ripberger\, Raymond/Army ROTC",FP&M Campus Planning and Landscape Architecture,Military Science (Army ROTC),Lakeshore Nature Preserve,,,,,60,,CPLA Academic Coordination Report 2014 bryn.xlsx,Spreadsheet,FA,,Summer Science Institute/ Biocore Prairie,2005,,"Bryn Scriver (FPM)\, Bohanan\, Robert/Steffansen\, Rebeccah/Institute for Biology Education/Biocore ",FP&M Campus Planning and Landscape Architecture,Biocore,Lakeshore Nature Preserve,,,,,,,CPLA Academic Coordination Report 2014 bryn.xlsx,Spreadsheet,FA,,IES 375: Field Ecology Workshop/Quarter Point Survey of Caretakers Woods,2005,,"Bryn Scriver (FPM)\, Carpenter\, Quentin/Nelson Institute",FP&M Campus Planning and Landscape Architecture,"Environmental Studies\, Nelson Institute for",Lakeshore Nature Preserve,,,,,,,CPLA Academic Coordination Report 2014 bryn.xlsx,Spreadsheet,FA,,IES 375: Field Ecology Workshop/Quarter Point Re-survey of Caretakers Woods,2005,,"Bryn Scriver (FPM)\, Carpenter\, Quentin/Nelson Institute ",FP&M Campus Planning and Landscape Architecture,"Environmental Studies\, Nelson Institute for",Lakeshore Nature Preserve,,,,,,,CPLA Academic Coordination Report 2014 bryn.xlsx,Spreadsheet,FA,,"Zoo 677: Study of the Distribution\, Relative Abundance\, and Age Structure of Norway Maples in a Mesic Woodland Community",2005,,"Bryn Scriver (FPM)\, Dodson\, Stanley; Bohanan\, Robert/Zoology",FP&M Campus Planning and Landscape Architecture,Zoology,Lakeshore Nature Preserve,,,,,2,,CPLA Academic Coordination Report 2014 bryn.xlsx,Spreadsheet,FA,,CEE 619: Groudwater Investigation of Class of 1918 Marsh,2005,,"Bryn Scriver (FPM)\, Potter\, Ken/Civil and Environmental Engineering",FP&M Campus Planning and Landscape Architecture,Civil and Environmental Engineering,Lakeshore Nature Preserve,,,,,,,CPLA Academic Coordination Report 2014 bryn.xlsx,Spreadsheet,FA,,Dispersal of Gypsy Moth Pathogens,2005,,"Bryn Scriver (FPM)\, Raffa\, Ken; Neilsen\, Charlotte",FP&M Campus Planning and Landscape Architecture,,Lakeshore Nature Preserve,,,,,,,CPLA Academic Coordination Report 2014 bryn.xlsx,Spreadsheet,FA,,Picnic Point birds,2006,,"Bryn Scriver (FPM)\, Bohanan\, Robert/Sampson\, April/Institute for Biology Education",FP&M Campus Planning and Landscape Architecture,,Lakeshore Nature Preserve,,,,,,,CPLA Academic Coordination Report 2014 bryn.xlsx,Spreadsheet,FA,,IES 375: Field Ecology Workshop/Tree Survey Big Woods,2006,,"Bryn Scriver (FPM)\, Carpenter\, Quentin/Dubovsky\, Jason/Nelson Institute  ",FP&M Campus Planning and Landscape Architecture,"Environmental Studies\, Nelson Institute for",Lakeshore Nature Preserve,,,,,,,CPLA Academic Coordination Report 2014 bryn.xlsx,Spreadsheet,FA,,IES 375: Field Ecology Workshop/Vegetation Survey University Bay,2006,,"Bryn Scriver (FPM)\, Carpenter\, Quentin/Matthews\, Eric/Nelson Institute",FP&M Campus Planning and Landscape Architecture,"Environmental Studies\, Nelson Institute for",Lakeshore Nature Preserve,,,,,,,CPLA Academic Coordination Report 2014 bryn.xlsx,Spreadsheet,FA,,IES 375: Field Ecology Workshop/Quarter Point Forest Survey Exercise,2006,,"Bryn Scriver (FPM)\, Carpenter\, Quentin/Nelson Institute ",FP&M Campus Planning and Landscape Architecture,"Environmental Studies\, Nelson Institute for",Lakeshore Nature Preserve,,,,,20,,CPLA Academic Coordination Report 2014 bryn.xlsx,Spreadsheet,FA,,Navy ROTC ,2006,,"Bryn Scriver (FPM)\, Clay\, Darwin",FP&M Campus Planning and Landscape Architecture,Naval Science (Naval ROTC),Lakeshore Nature Preserve,,,,,,,CPLA Academic Coordination Report 2014 bryn.xlsx,Spreadsheet,FA,,Fantasy film for K-4 Reading Project,2006,,"Bryn Scriver (FPM)\, Doebel\, Steve/WI Public Television",FP&M Campus Planning and Landscape Architecture,,Lakeshore Nature Preserve,,,,,,,CPLA Academic Coordination Report 2014 bryn.xlsx,Spreadsheet,F,,Gypsy Moth Pathogens,2006,,"Bryn Scriver (FPM)\, Raffa\, Ken; Hajek\, Ann; Hannam\, Josh",FP&M Campus Planning and Landscape Architecture,,Lakeshore Nature Preserve,,,,,,,CPLA Academic Coordination Report 2014 bryn.xlsx,Spreadsheet,FS,,Rust Spore Dispersal Gradient Study in Biocore Prairie,2006,,"Bryn Scriver (FPM)\, Newcomb\, Maria/Plant Pathology",FP&M Campus Planning and Landscape Architecture,Plant Pathology,Lakeshore Nature Preserve,,,,,,,CPLA Academic Coordination Report 2014 bryn.xlsx,Spreadsheet,FA,,Summer Science Institute in Lot 34,2007,,"Bryn Scriver (FPM)\, Sievers\, Emily/Nelson Institute/WRM",FP&M Campus Planning and Landscape Architecture,"Environmental Studies\, Nelson Institute for",Lakeshore Nature Preserve,,,,,3,,CPLA Academic Coordination Report 2014 bryn.xlsx,Spreadsheet,FA,,"Military Science 110\, 210\, 310\, 410",2008,,"Bryn Scriver (FPM)\, Aeschliman\, Joshua/Army ROTC",FP&M Campus Planning and Landscape Architecture,Military Science (Army ROTC),Lakeshore Nature Preserve,,,,,60,,CPLA Academic Coordination Report 2014 bryn.xlsx,Spreadsheet,FA,,Wildlife Ecology Capstone 599: Montoring Human use and impact on wetlands in Preserve,2008,,"Bryn Scriver (FPM)\, Cardinal\, Casey/FWE ",FP&M Campus Planning and Landscape Architecture,Forest and Wildlife Ecology,Lakeshore Nature Preserve,,,,,,,CPLA Academic Coordination Report 2014 bryn.xlsx,Spreadsheet,FA,,Turtle Study,2008,,"Bryn Scriver (FPM)\, Dassow\, Angela/Zoology",FP&M Campus Planning and Landscape Architecture,Zoology,Lakeshore Nature Preserve,,,,,,,CPLA Academic Coordination Report 2014 bryn.xlsx,Spreadsheet,FA,,Edible Mushroom Workshop,2008,,"Bryn Scriver (FPM)\, Foltz\, Sarah/Earth Center",FP&M Campus Planning and Landscape Architecture,Lakeshore Nature Preserve,,,,,,,,CPLA Academic Coordination Report 2014 bryn.xlsx,Spreadsheet,FA,,PEOPLE Summer Program,2008,,"Bryn Scriver (FPM)\, Gooch\, Michelle/PEOPLE Program",FP&M Campus Planning and Landscape Architecture,Lakeshore Nature Preserve,,,,,,,,CPLA Academic Coordination Report 2014 bryn.xlsx,Spreadsheet,FA,,LA 666: Eagle Heights Woods,2008,,"Bryn Scriver (FPM)\, Howell\, Evelyn; Harrington\, John/Landscape Architecture",FP&M Campus Planning and Landscape Architecture,Landscape Architecture,Lakeshore Nature Preserve,,,,,,,CPLA Academic Coordination Report 2014 bryn.xlsx,Spreadsheet,FA,,Geography/Geology 320: Geomorphology Lab,2008,,"Bryn Scriver (FPM)\, Mason\, Joseph/Geography",FP&M Campus Planning and Landscape Architecture,Geography,Geoscience,Lakeshore Nature Preserve,,,,25,,CPLA Academic Coordination Report 2014 bryn.xlsx,Spreadsheet,FA,,Acoustic Bat Reference library & fall migration study,2008,,"Bryn Scriver (FPM)\, Redell\, Dave/WI DNR",FP&M Campus Planning and Landscape Architecture,Lakeshore Nature Preserve,,,,,,,,CPLA Academic Coordination Report 2014 bryn.xlsx,Spreadsheet,FA,,Survey of Underwater Habitat,2008,,"Bryn Scriver (FPM)\, Schultz\, Matt/Hoofers SCUBA",FP&M Campus Planning and Landscape Architecture,Lakeshore Nature Preserve,,,,,,6,,CPLA Academic Coordination Report 2014 bryn.xlsx,Spreadsheet,FS,,Warrior Week,2008,,"Bryn Scriver (FPM)\, Surita\, Jose/Air Force ROTC",FP&M Campus Planning and Landscape Architecture,Aerospace Studies (Air Force ROTC),Lakeshore Nature Preserve,,,,,,,CPLA Academic Coordination Report 2014 bryn.xlsx,Spreadsheet,FA,,Botany 100 (summer session): Muir Woods Jack in the Pulpit/correlations between plant size and sex,2008,,"Bryn Scriver (FPM)\, Trest\, Marie/Botany",FP&M Campus Planning and Landscape Architecture,Botany,Lakeshore Nature Preserve,,,,,50,,CPLA Academic Coordination Report 2014 bryn.xlsx,Spreadsheet,FA,,Botany/Plant Pathology 332: Field Trips and Specimen Collection for fungi class,2008,,"Bryn Scriver (FPM)\, Trest\, Marie/Botany/Plant Pathology 332",FP&M Campus Planning and Landscape Architecture,Botany,Lakeshore Nature Preserve,,,,,25,,CPLA Academic Coordination Report 2014 bryn.xlsx,Spreadsheet,FA,,Wildlife Ecology Capstone 599: Pilot Study on Blue Winged Teal,2008,,"Bryn Scriver (FPM)\, Williams\, Riley/FWE ",FP&M Campus Planning and Landscape Architecture,Forest and Wildlife Ecology,Lakeshore Nature Preserve,,,,,,,CPLA Academic Coordination Report 2014 bryn.xlsx,Spreadsheet,FA,