,Green Cleaning by Janitorial Services,Ongoing,"Janitorial Services is leading trials in 7 new buildings to replace many of their conventional cleaning products with green seal certified products. Includes precise mixing procedures.  School of Nursing\, ozonated water is being tested as a antimicrobial replacement for bleach. In 2015 Janitorial Services wil expand green cleaning initative to over half of all campus buildings.  Subsequent buildings will be included as old product is used up. ",Steve Heitz-Janitorial,FP&M Physical Plant ,,,,,,,,,http://sustainability.wisc.edu/news-and-events/university-operations-utilize-green-cleaning-supplies/,website,F,,Salt Reduction Initiatives,,"Salt use optimization initiatives including training and certification for grounds crews in best mgmt. practices.  Focus on correct timing\, quantity\, and type of ice melt products.  Circulation of training video  to sister departments in FPM that apply salt on campus.",Ellen Agnew - Bldg/Grounds Supt.,FP&M Physical Plant ,,,,,,,,,,Personal Communication,F,,Sustainable Lawn Care,,"A trial of sustainable and organic lawn care techniques on Bascom Hill turf involving aerating\, overseeding\, compost application\, and minimal weed spraying.",Ellen Agnew - Bldg/Grounds Supt.,FP&M Physical Plant ,,,,,,,,,,Personal Communication,F,,Leaf Composting,,"Program to collect and compost 100% of the campus' leaf material.  Leaf material is collected in the fall\, transported to grounds' material depot\, mixed with manure from Ag. Research Station\, composted\, and then reapplied to campus grounds.",Ellen Agnew - Bldg/Grounds Supt.,FP&M Physical Plant ,,,,,,,,,,Personal Communication,F,,Planters for We Conserve's edible Landscape project,,Grounds staff constructed and filled 6 large raised bed structures for We Conserve student group to create edible gardens on campus,Ellen Agnew - Bldg/Grounds Supt.,FP&M Physical Plant ,,,,We Conserve,,,,,,Personal Communication,FS,,Green Roof Maintanence Guide,,Grounds department created a maintenance guide for the 14 green roofs on campus that includes use of mulch instead of chemical weed treatments,Ellen Agnew - Bldg/Grounds Supt.,FP&M Physical Plant ,,,,,,,,,,Personal Communication,F,,Cleaning Up our Trash,4/1/09,"Waste Bin audits wherein trash contents were identified\, sorted\, and recorded. Campus waste bins had 25%-47% recyclable materials in the sorted trash bags. Recommendations were made to improve recycling rates","James Harrod - FP&M\, Michael Amato - Dept. of Psychology",FP&M Physical Plant ,,,,We Conserve,,,,,Cleaning Up Our Trash (Cleaning_Up_Our_Trash_Harrod_Amato_2009.pdf),Program Review,FS,,Waste and Recycling Programs,1/1/14,"Physical Plant is responsible for all handling and tracking all waste and recycling from campus facilities.  The department collects numerous streams of material.  Recyclables include appliances\, books\, comingled\, food compost\, yard compost\, office paper\, newspaper/cardboard\, pallets\, scrap metal\, tires\, and wood.   Detailed records of tonnages for each stream have been collected since 1998 and track a steady increase in recycling rates.  From 1998 to 2014 the % recycled has climbed from approximately 30% to 40%.  The recent successful implementation of food and yard waste composting has significantly contributed to this improvement","Kris Aukerbauer (Physical Plant)\, Lyle Jelle",FP&M Physical Plant ,We Conserve,,,,,,,,W & R Metrics Sept 2014 .xlsx,spreadsheet,FS,,Who turned out the incandescent lights?,10/14/14,"Curriculum development with ES126 using campus lighting upgrades as the experiential learning focus. Successful learning outcomes were facilitated by collaboration between Dr. Middlecamp and Physical Plant using campus as a ""living-learning laboratory.""","Tim Lindstrom\, Faramarz Vakili\, Cathy Middlecamp",FP&M Physical Plant ,"Environmental Studies\, Nelson Institute for",,,,,,,,Campus Lighting & ES 126 (Draft),Journal Article,FA,,Pre-Consumer Food Waste Diversion at Monona Terrace,5/1/11,"Collaboration between We Conserve and Monona Terrace to reduce food scraps in waste stream\, quantification of CO2 reductions. 9 month program diverted 11 tons of food scraps\, saved $1\,473 in tipping fees\, and avoided 9.7 tons of CO2 emissions.","Lea Zeise\, Joseph Van Rossum",FP&M Physical Plant ,,,,We Conserve,,,,,11 MSN Zeise Monona Terrace Compost.pdf,Program Review,FA,,Energy Conservation Program Overview,1/1/14,The State of Wisonsin supported the UW Madison with a $60 million investment to finance energy efficiency upgrades from 2006-2014.  17% was spent on lighting upgrades and 83% was spent on HVAC upgrades.  This helped the campus reach its goal of a 20% energy use reduction compared to 2006 levels despite a 15% increase in gross square footage of campus buildings. The energy use reductions save the UW $8 million each year.,Faramarz Vakili,FP&M Physical Plant ,We Conserve,,,,,,,,general scope ESCO.xlsx,Program Review,F,,Fume Hood Replacements,,"1. Replace existing  fume hoods with new high performance\, low-flow fume hoods Decommission and remove fume hoods not in use and associated air test and balancing:  Add occupancy sensors to each space required for inactive mode and add fume hood presence control sensors to Fume Hoods. Furnish and install new dual mode monitors/alarms on the existing fume hoods.",Randy Hagar,FP&M Physical Plant ,We Conserve,,,,,,,,general scope ESCO.xlsx,Program Review,F,,HVAC improvement,,"2.  Reduce supply air and outside airflow quantities based on reduction in exhaust air flows\, on Vav systems.",Randy Hagar,FP&M Physical Plant ,We Conserve,,,,,,,,general scope ESCO.xlsx,Program Review,F,,HVAC improvement,,"3. Reduce SA\,EA\,and OA during select occupancies times. Replace pneumatic mechanical systems controls with new direct digital controls ",Randy Hagar,FP&M Physical Plant ,We Conserve,,,,,,,,general scope ESCO.xlsx,Program Review,F,,HVAC improvement,,"4. New Air economizer dampers\, adds lower leakage rates from outside air and reduces amount of heating/cooling ",Randy Hagar,FP&M Physical Plant ,We Conserve,,,,,,,,general scope ESCO.xlsx,Program Review,F,,HVAC improvement,,5. Implements in select air handling systems a retrofit of existing constant volume systems to a variable air volume (VAV) system. The VAV retrofit enables reducing supply and exhaust airflows for non-lab spaces . Provide air handlers with new variable frequency drives installed to manage the supply airflow.,Randy Hagar,FP&M Physical Plant ,We Conserve,,,,,,,,general scope ESCO.xlsx,Program Review,F,,Lighting Upgrades,,"6. Replace one-lamp and two-lamp T-12 lamps and ballasts with T-8 electronic ballasts and fluorescent lamps. Replace light fixtures\, where appropriate. Replace parking lot lighting with LED .2) Optimizing lighting use by installing occupancy sensors in areas of intermittent traffic and photo sensors in spaces with sufficient natural light",Randy Hagar,FP&M Physical Plant ,We Conserve,,,,,,,,general scope ESCO.xlsx,Program Review,F,,Steam Tunnel Insulation Replacement,,"7. Replace insulation on steam and condensate piping\, valves\, and joint within approximately 7\,700 feet of tunnel and (109)-pits which are presently covered with inefficient and deteriorated insulation systems.",Randy Hagar,FP&M Physical Plant ,We Conserve,,,,,,,,general scope ESCO.xlsx,Program Review,F,,Metering,,"8. Metering: add new Chilled Water\, Steam\, Electrical Power per requirements:",Randy Hagar,FP&M Physical Plant ,We Conserve,,,,,,,,general scope ESCO.xlsx,Program Review,F,,Building System Optimization,,9. System commissioning : re commission buildings to optimize ,Randy Hagar,FP&M Physical Plant ,We Conserve,,,,,,,,general scope ESCO.xlsx,Program Review,F,,We Conserve Mission,,The We Conserve initiative began in with the goal of reducing the campus environmental footprint by 20% relative to 2006  levels. A 60 million dollar investment from the State of Wisconsin was used to meet this goal by 2010. ,Faramarz Vakili,FP&M Physical Plant ,We Conserve,,,,,,,,http://conserve.wisc.edu/literate-activism.html#,Website,FA,,Freshwater Usage Reduction - Fixtures,2002-2008,"Thousands of low flow plumbing fixtures including showerheads\, toilets\, and sinks have been installed on campus. A 41% reduction in UW-Madisons daily water consumption between 2002 and 2008.  Contributing to the 178 million gallons of water saved annually since 2006.",Faramarz Vakili,FP&M Physical Plant ,We Conserve,,,,,,,,http://conserve.wisc.edu/water.html#,Website,F,,Freshwater Usage Reduction - Irrigation,,"Campus irrigation has been limited to high traffic areas\, new plantings\, and before 10am to reduce losses from evaporation. A 41% reduction in UW-Madisons daily water consumption between 2002 and 2008.  Contributing to the 178 million gallons of water saved annually since 2006.",Faramarz Vakili,FP&M Physical Plant ,We Conserve,,,,,,,,http://conserve.wisc.edu/water.html#,Website,F,,Freshwater Usage Reduction - Mechanical Systems,2002-2008,Air conditioning systems cooled with potable water were replaced with more energy efficient alternatives. A 41% reduction in UW-Madisons daily water consumption between 2002 and 2008.  Contributing to the 178 million gallons of water saved annually since 2006.,Faramarz Vakili,FP&M Physical Plant ,We Conserve,,,,,,,,http://conserve.wisc.edu/water.html#,Website,F,,Water Infrastructure Tracking System,,GIS based inventory of water delivery pipes aids in proactive maintenance and replacement,Faramarz Vakili,FP&M Physical Plant ,We Conserve,,,,,,,,http://conserve.wisc.edu/water.html#,Website,F,,Rainwater Collection at Wisconsin Institute for Medical Research,,Students helped install a rainwater barrel at the Institute for Medical Research. Rainwater replaced 50% of freshwater used for garden irrigation,Faramarz Vakili,FP&M Physical Plant ,We Conserve,,,,,,,,http://conserve.wisc.edu/water.html#,Website,FS,,"Energy Use\, Building Systems and Appliances",,"A combination of fine-tuning\,maintanence best practices and building occupant engagement to reduce energy use across campus. Reductions in energy usage after retrofits: Biotron 50%\, Bock Labs 64%\, Biotech 42%\, Engineering Centers 43%\, Chemistry 29%\, Engineering Hall 42%\, Rennebohm 53%\, and Chamberlin Hall 66%.",Faramarz Vakili,FP&M Physical Plant ,We Conserve,,,,,,,,http://conserve.wisc.edu/energy.html#,Website,F,,"Energy Use\, Generation\, purchases and Distribution",,"Optimization of the campus central utility plants for generation of steam\, chilled water\, electricity\, and compressed air.  ",Faramarz Vakili,FP&M Physical Plant ,We Conserve,,,,,,,,,Website,F,,Charter Street Heating Plant Natural Gas Conversion,7/4/05,Conversion of heating plant from coal to natural gas. 44% reduction in greenhouse gas emissions.,Rob Laampa,FP&M Physical Plant ,We Conserve,,,,,,,,http://sustainability.wisc.edu/forum2014/videos/#Welcome,Presentation,F,,Renewable Energy Credits,,"UW Madison purchases renewable energy credits that help finance renewable energy generation and development\, offsetting a portion of the University's carbon footprint. Wind provides the equivalent of 15% of campus electricity.",Faramarz Vakili,FP&M Physical Plant ,We Conserve,,,,,,,,http://conserve.wisc.edu/energy.html#,Website,F,,Utilities Distribution Infrastructure,,"Reconditioning of utilities distribution infrastructure for optimized safety\, energy\, efficiency\, and maintainability",Faramarz Vakili,FP&M Physical Plant ,We Conserve,,,,,,,,http://conserve.wisc.edu/energy.html#,Website,F,,Promoting Responsible Consumption,,Poster Advertisement Campaign to discourage excessive consumerism,Faramarz Vakili,FP&M Physical Plant ,We Conserve,,,,,,,,http://conserve.wisc.edu/materials.html#,Website,FA,,Filtered Water Stations,,150 Filtered Water stations around campus eliminate the need for hundreds of thousands of plastic bottles annually.,Dwayne Williams (We Conserve),FP&M Physical Plant ,We Conserve,,,,,,,,Operations Programs for this year.docx,Program Review,F,,Reusable Food Containers at U. South,,On-the-Go reusable containers will soon replace disposables at Union South.,Faramarz Vakili,FP&M Physical Plant ,We Conserve,,,,,,,,http://conserve.wisc.edu/materials.html#,Website,F,,InkJet and Printer cartridge refill program,,Ink cartridges can be sent through campus mail to be refiled at specific locations.  ,Faramarz Vakili,FP&M Physical Plant ,We Conserve,,,,,,,,http://conserve.wisc.edu/materials.html#,Website,F,,Housing Move out Waste Reduction ,,Recycling and student donations at housing move-outs redirect materials from landfills. Landfill contributions reduced by half. ,Faramarz Vakili,FP&M Physical Plant ,We Conserve,,,,,,,,http://conserve.wisc.edu/materials.html#,Website,FS,,WE-Trade Program,,"Encourages the trading of valuable assets including building space\, computing capacity\, laboratory equipment\, etc. in exchange for additional funding\, upgraded space/equipment\, and WE-credits",Faramarz Vakili,FP&M Physical Plant ,We Conserve,,,,,,,,http://conserve.wisc.edu/materials.html#,Website,F,,Campus compost drop off locations,,"6 drop off locations serve as a way to divert food compost from entering the waste stream.  These personal drop off locations complement the commercial scale composting at UW Housing Dining Halls\, The Unions\, UW Hospital\, Athletics\, and Monona Terrace. Compost is returned to campus as fertilizer for the grounds department.",Faramarz Vakili,FP&M Physical Plant ,We Conserve,,,,,,,,http://conserve.wisc.edu/materials.html#,Website,F,,Computers and E-Waste Recycling,,Small device recycling through recycling towers located around campus and the DoIT free recycling program,Dwayne Williams (We Conserve),FP&M Physical Plant ,,,,We Conserve,,,,,Operations Programs for this year.docx,Program Review,FS,,Housing Recycling,,"In partnership with UW Housgin\, goal for every dorm to have two bins for recycling\, an in-room guide\, as well as a large poster guide in recycling rooms. Goal to achieve zero contamination of recycling stream.",Dwayne Williams (We Conserve),FP&M Physical Plant ,,,,We Conserve,,,,,Operations Programs for this year.docx,Program Review,FS,,Athletic Game Day Recycling,,"In partnership with Athletics\, We Conserve assists with recycling efforts at all football\, hockey\, basketball\, wrestling\, and volleyball games.",Dwayne Williams (We Conserve),FP&M Physical Plant ,,,,,,,,,Operations Programs for this year.docx,Program Review,FS,,Greeks Go Green,,"Helping Greek Culture to adopt recycling\, composting\, and volunteerism.",Dwayne Williams (We Conserve),FP&M Physical Plant ,,,,We Conserve,,,,,Operations Programs for this year.docx,Program Review,FS,,DOE STEP Initiative,,Exploration of a 10 Mw s-CO2 Turbine installation at the UW Charter Street Plant.,Rob Laampa,FP&M Physical Plant ,,,,,,,,,SCO2 presentation.pptx,Presentation,FA,,UW Boxable,,Boxable seeks to divert all expanded polystyrene from the landfill by creating pathways for local reuse and recycling. Physical plant and WeConserve coordinate the collection and recycling of styrofoam shipping boxes which are diverted from landfills and turned into useful consumer products. ,"The program is nationally recognized by the U.S. EPA and has won both Phase-I and Phase-II funding\, being awarded a total of $105\,000\, through the People\, Prosperity\, and the Planet (P3) student design competition for sustainability.",FP&M Physical Plant ,,,,We Conserve,,,,,http://sustainability.wisc.edu/styrofoam/,Website,FS,,Space Management Office Mission Statement,,"The mission of the Space Management Office is to collect\, maintain\, supply and analyze UW-Madison facility utilization information; to identify\, assign and acquire space and real property resources required for all university academic\, research and administrative programs on and off campus; and to provide and support modern learning spaces with enhanced instructional technology.",Doug Rose,FP&M Space Management Office,,,,,,,,,https://fpm-www3.fpm.wisc.edu/spacemanagementoffice/Home/AboutUs/tabid/98/Default.aspx,Website,F,,Space Utilization - Instructional - Classroom Utilization Study,6/1/12,"Through an Administrative Process Redesign (APR)\, a  team including the Space Management Office sought to develop an understanding of the current drivers and processes attendant to the utilization of classroom space and to use that knowledge to develop a plan for increasing the usage of or repurposing this space across campus. The team identified a number of opportunities to improve utilization\, including repurposing underutilized and/or unutilized space\, encouraging greater policy compliance\, exploring the use of enterprise-wide instructional space scheduling\, implementing a master scheduling calendar and creating incentives for more strategic decisions regarding use of space. ",Doug Rose,FP&M Space Management Office,,,,,,,,,http://www.apr.wisc.edu/classroomspace.htm,Website,FA,,Space Utilization - Instructional - Utilization Review,5/1/13,"Through an Administrative Process Redesign (APR)\, this team was chartered to develop criteria and processes to evaluate underutilized instructional space and to define a process to determine the most effective utilization of instructional space\, including repurposing space\, increase instructional use\, upgrading technology and/or room features\, reclassifying primary use and decommission the use of the space. The team recommended new process to regularly review instructional space utilization and delineated steps to determine and recommend appropriate future instructional use and disposition of general assignment and department-controlled rooms that are utilized less than campus policy rate (67%).",Doug Rose,FP&M Space Management Office,,,,,,,,,http://www.apr.wisc.edu/instrspace.htm,Website,FA,,Space Utilization - Instructional - College of Engineering Feasibility Modeling,6/1/14,"Through an Administrative Process Redesign (APR)\, this team's goal was to develop a model for evaluating the feasibility of various scheduling scenarios. By applying an array of constraints\, the team will deliver data outcomes that should help set direction for a scheduling pilot program. The study showed that using optimization techniques for scheduling can result in improved utilization of instructional space\, and has potential to reduce the overall number of rooms required to deploy the curriculum in the CoE.",Doug Rose,FP&M Space Management Office,"Engineering\, College of",,,,,,,,http://www.apr.wisc.edu/coemodeling.htm,Website,FA,,INSITE Facilities Application,,"To better meet the Space Management Department’s space utilization\, alignment\, and planning goals\, we transitioned to a new web-based facility application\, INSITE (Net-FM). This program integrates facilities information with other campus data sources and allows implementation of new business practices for the university to achieve streamlined data collection\, efficient school/college/department data access\,and improved ability to link Principle Investigators and research grants to space.",Doug Rose,FP&M Space Management Office,,,,,,,,,https://fpm-www3.fpm.wisc.edu/spacemanagementoffice/Default.aspx,Website,F,,Hospital Garage Expansion - LED Lighting Upgrade,10/14/14,Transportation Services collaborated with CP&D to replace metal halide and spec. LED lamps for exterior lamp posts,Patrick J Kass,FP&M Transportation Services,,,,,,,,,,personal communication,F,,Transportation Services Sustainability Partnerships,8/18/14,An overview of Transportation Services numerous collaborations in multiple fields of sustainability  up to 2014,Patrick J Kass,FP&M Transportation Services,,,,,,,15,,Transportation Services Sustainability Partnerships,Program Review,F,,Lighted Regulatory Sign Study,8/18/14,1. School of Engineering TOPS students are evaluating two types of lighted regulatory signs on campus streets to evaluate their effectiveness in increasing driver compliance and safety. 2014,,FP&M Transportation Services,Civil and Environmental Engineering,Traffic Operations and Safety Lab,,,,,15,,Transportation Services Sustainability Partnerships,Program Review,FA,,Student mapping project,8/18/14,"3. Student interns in FPM’s Planning unit typically work with TS on a dozen or more design and mapping projects related to parking\, bus and bicycle facilities\, sidewalks\, and streets. 2005 - 2014",,FP&M Transportation Services,,,,,,,,,Transportation Services Sustainability Partnerships,Program Review,FS,,Presentations to TOPS classes,8/18/14,"4. Several times over the past five years\, TS Director has presented at TOPS classes describing such things as the transportation aspects of specific major projects as well as the campus’ sustainable Long Range Transportation Plan. 2010 -2013.",Patrick Kass,FP&M Transportation Services,Civil and Environmental Engineering,Traffic Operations and Safety Lab,,,,,15,,Transportation Services Sustainability Partnerships,Program Review,FA,,Power Washing Drains,8/18/14,Added pits in 2012 and 2013 to lots 17 and 76 to ensure waste water from power washing goes to a sanitary sewer thus preventing contamination of lakes.,,FP&M Transportation Services,,,,,,,,,Transportation Services Sustainability Partnerships,Program Review,F,,Garage Clean Up for storm water,8/18/14,Added student staff to increase sweeping in garages thus reducing sand from entering storm water and providing students with supplemental income and work experience,,FP&M Transportation Services,,,,,,,3,,Transportation Services Sustainability Partnerships,Program Review,FS,,Moped Mgmt.,8/18/14,"TS Collaborated with City of Madison to improve moped parking management and reduce accidents\, vehicle circulation\, and energy consumption.",,FP&M Transportation Services,,,,,,,,,Transportation Services Sustainability Partnerships,Program Review,F,,Waste Reduction at parking lots,8/18/14,"Collaborated with We Conserve students to measure recycling and waste in garages during event days\, specifically hockey and basketball games in Lot 46.  Resulted in increasing the number of trash receptacles.",,FP&M Transportation Services,,,,We Conserve,,,,,Transportation Services Sustainability Partnerships,Program Review,FS,,Parking Enforcement,8/18/14,"Increased the number of students writing citations providing improved compliance\, reduced fuel consumption\, and provided students with supplemental income while encouraging students to walk & bike while enforcing.",,FP&M Transportation Services,,,,,,,5,,Transportation Services Sustainability Partnerships,Program Review,FS,,Carpool Permit,8/1/14,Designated carpool permit allows carpools of 3+ people to receive parking permits without having to go through the priority assignment process. Launched Fall of 2014,Dar Ward,FP&M Transportation Services,,,,,,,,,Transportation Services Sustainability Partnerships,Program Review,F,,Electric Vehicle Charging Stations,7/1/14,"Electric vehicle charging survey completed in 2013 to determine demand. Stations initiated in July of 2014. 7 locations on campus providing free electric vehicle charging (Lot 7\, 17\, 20\, 29\, 36\, 64\, 75). Each location has two charging plugs. Lot 75 is a partnership with a private donor. Lot 64 is a partnership with MG&E",Dar Ward,FP&M Transportation Services,,,,,,,,,Transportation Services Sustainability Partnerships,Program Review,F,,UW Housing Bicycle Program,1/1/14,TS partnered with UW Housing to take over management of their bicycle program to enhance consistency and accessible of bicycle parking on the campus. Initiated spring 2014.,Dar Ward,FP&M Transportation Services,UW Housing,,,,,,,,Transportation Services Sustainability Partnerships,Program Review,F,,Reduction in Vehicle Idling Emissions Through Conversion of Signaled Intersection to Roundabout,12/27/13,Study of emissions reductions from conversion of Walnut and Observatory traffic light to roundabout. 83.7 Metric tons of CO2 are avoided annually from conversion to roundabout intersection.,"Dawson\, Pakes-Ahlman\, Kennedy",FP&M Transportation Services,Civil and Environmental Engineering,Traffic Operations and Safety Lab,Office of Sustainability,,,,,,Roundabout Emissions Reductions Final,UW Faculty Research,FA,,Reduction in Vehicle Idling Emissions Using RFID Parking Permits,9/20/13,Analysis of RFID program to reduce vehicle idling emissions. Savings of 12.2 metric tons of CO2 emissions. Technology is now in use across the entire campus as well as at other leading collegiate institutions,"Dawson\, Pakes-Ahlman\, Graham\, Gutierrez\, Vilasdaeschanont",FP&M Transportation Services,Civil and Environmental Engineering,Radio Frequency ID Lab,,,,,10,,End of Summer report.docx,Working Document,FR,, UW Hospital Park and Ride at Hillfarms ,9/1/13, Partnered with UW Hospital to fund the operation of a park and ride facility at Hillfarms to provide additional access to parking while reducing the number of single occupancy vehicles on the campus.,Dar Ward,FP&M Transportation Services,UW Hospital,,,,,,,,Transportation Services Sustainability Partnerships,Program Review,F,,Park and Ride facility at Wingra ,9/1/13,Provided park and ride facility  to provide additional access to parking while reducing the number of single occupancy vehicles on the campus.,Dar Ward,FP&M Transportation Services,,,,,,,,,Transportation Services Sustainability Partnerships,Program Review,F,,2012 On-Board Campus Bus Survey ,3/21/12,"A 4 day survey conducted during standard service schedule to identify ridership information. Approximately: 80% students\, 14% staff. 22% Eagle Heights\, 23% residence halls\, 50% other. 74% undergrad\, 21% graduate. 81% 12+credits.",TS Staff,FP&M Transportation Services,,,,,,,5,,2012_Campus_Bus_Survey_Final_Report(FINAL).pdf,Survey,F,